{
  "schema_version": 4,
  "host_id": "host-alpha",
  "run_id": "run-20260702-a",
  "vm_name": "webserver",
  "desired_version": 42,
  "observed_at_unix_ms": 1762041660000,
  "phase": "ready",
  "guest_tools": {
    "tools_disk_sha256": "1111111111111111111111111111111111111111111111111111111111111111",
    "kino_sha256": "2222222222222222222222222222222222222222222222222222222222222222",
    "bootstrap_abi": 2,
    "verified": true
  },
  "network": {
    "bridge_name": "intar-run-a",
    "guest_ip": "10.77.0.2",
    "guest_cidr": "10.77.0.2/28",
    "gateway": "10.77.0.1",
    "ssh_host_port": 22001
  },
  "terminal": {
    "state": "ready",
    "target": {
      "host": "203.0.113.10",
      "port": 22001,
      "username": "ubuntu",
      "checked_at_unix_ms": 1762041659000
    },
    "observed_at_unix_ms": 1762041659000
  },
  "runtime_constraints": {
    "generation": "vm-01jz8w5pjcr7xz6j8p8q2c49ds",
    "phase": "steady",
    "steady_cpu_millis": 125,
    "effective_cpu_millis": 125,
    "quota_verified_at_unix_ms": 1762041658000
  },
  "resource_state": {
    "cpu_millis": 125,
    "vcpu_count": 1,
    "cpu_quota_us": 12500,
    "cpu_period_us": 100000,
    "cpu_usage_usec": 3125000,
    "cpu_user_usec": 2500000,
    "cpu_system_usec": 625000,
    "cpu_nr_periods": 300,
    "cpu_nr_throttled": 299,
    "cpu_throttled_usec": 21875000
  },
  "sandbox": {
    "healthy": true,
    "generation": "vm-01jz8w5pjcr7xz6j8p8q2c49ds",
    "systemd_unit": "intar-vm-vm-01jz8w5pjcr7xz6j8p8q2c49ds.service",
    "cgroup_path": "/intar.slice/intar-vms.slice/intar-vm-vm-01jz8w5pjcr7xz6j8p8q2c49ds.service",
    "seccomp_enabled": true,
    "landlock_enabled": true,
    "no_new_privs": true
  },
  "ssh_host_keys_openssh": [
    "ssh-ed25519 AAAAC3NzaC1lZDI1NTE5AAAAIhostkey webserver"
  ],
  "probes": [
    {
      "id": "nginx-running",
      "phase": "scenario",
      "status": "fail",
      "checked_at_unix_ms": 1762041655000,
      "message": "nginx is stopped",
      "value": {
        "service": "nginx",
        "desired_state": "running",
        "actual_state": "inactive"
      }
    }
  ],
  "archive": {
    "phase": "none",
    "artifact_count": 0
  }
}
